PAA Title,Parent,Text,URL,URL Title
How much coding is required for ML?,Is machine learning coding or non coding?,"Three programming languages come up most frequently: C++, Java, and Python, but it can get much more specific as well. Languages like R, Lisp, and Prolog become important languages to learn when specifically diving into machine learning.","https://brainstation.io/career-guides/does-machine-learning-require-coding#:~:text=Three%20programming%20languages%20come%20up,specifically%20diving%20into%20machine%20learning.",Does Machine Learning Require Coding? (2023 Guide) - BrainStation
What is machine learning syllabus?,Is machine learning coding or non coding?,Module 1 – Introduction to Machine Learning. Module 2 – Supervised Learning and Linear Regression. Module 3 – Classification and Logistic Regression. Module 4 – Decision Tree and Random Forest. Module 5 – Naïve Bayes and Support Vector Machine.,"https://intellipaat.com/blog/machine-learning-course-syllabus/#:~:text=Module%201%20%E2%80%93%20Introduction%20to%20Machine,Bayes%20and%20Support%20Vector%20Machine",Machine Learning Course Syllabus - 2023 - Intellipaat
Is ML a good career?,What are the skills required to learn ML?,"With a background in machine learning, you can get a high-paying job as a Machine Learning Engineer, Data Scientist, NLP Scientist, Business Intelligence Developer, or a Human-Centered Machine Learning Designer.","https://brainstation.io/career-guides/is-machine-learning-a-good-career#:~:text=With%20a%20background%20in%20machine,Human%2DCentered%20Machine%20Learning%20Designer.",Is Machine Learning a Good Career? (2023 Guide) | BrainStation®
What are the 2 types of learning ML?,What are the skills required to learn ML?,"There are primarily three types of machine learning: Supervised, Unsupervised, and Reinforcement Learning. Let's explore and understand the different types of machine learning one by one. 02-Feb-2023","https://www.simplilearn.com/tutorials/machine-learning-tutorial/types-of-machine-learning#:~:text=There%20are%20primarily%20three%20types,machine%20learning%20one%20by%20one.",Types of Machine Learning | Simplilearn
Is machine learning math or CS?,What is machine learning syllabus?,"Computer scientists invented the name machine learning, and it's part of computer science, so in that sense it's 100% computer science. 11-May-2016","https://www.forbes.com/sites/quora/2016/05/11/how-much-of-machine-learning-is-computer-science-vs-statistics/#:~:text=Computer%20scientists%20invented%20the%20name,sense%20it's%20100%25%20computer%20science.",How Much Of Machine Learning Is Computer Science Vs. Statistics?
Is Google a machine learning?,What is machine learning syllabus?,"   Google uses machine learning algorithms to provide its customers with a valuable and personalized experience. Gmail, Google Search and Google Maps already have machine learning embedded in services.","https://data-flair.training/blogs/how-google-uses-machine-learning/#:~:text=Google%20uses%20machine%20learning%20algorithms,machine%20learning%20embedded%20in%20services.",How Google uses Machine Learning to revolutionise the Internet World?
Is AI easier than ML?,Can I learn ML without maths?,"No, it isn't hard to learn AI or ML. Well nothing can be far from the truth. Both Artificial Intelligence and Machine Learning is a modern day technology that is gaining ground in nearly every phase of our lives. It may seem hard as it involves Mathematical algorithms, use of many tools, and platforms. 12-Jul-2021","https://intellipaat.com/community/79106/is-it-hard-to-learn-ai-or-ml#:~:text=No%2C%20it%20isn't%20hard,of%20many%20tools%2C%20and%20platforms.",Is it hard to learn AI or ML? - Intellipaat Community
Can I get job in ML without degree?,Can I learn ML without maths?,Advertisements for machine learning jobs typically require a degree or higher degree in machine learning or a closely related field. To practice machine learning research. Getting a higher degree in machine learning will give you the opportunity to practice machine learning research. 16-Jan-2014,"https://machinelearningmastery.com/what-if-i-dont-have-a-degree/#:~:text=Advertisements%20for%20machine%20learning%20jobs,to%20practice%20machine%20learning%20research.",What if I Don't Have a Degree - MachineLearningMastery.com
How many months does it take to learn ML?,Can I learn ML without maths?,"six months  Experts agree it takes six months or more to master ML basics. Top skills for machine learning pros include programming languages like Python and R, databases like MySQL, and natural language processing (NLP).","https://www.nobledesktop.com/learn/machine-learning/how-long-does-it-take-to-learn-machine-learning#:~:text=Experts%20agree%20it%20takes%20six,natural%20language%20processing%20(NLP).",How Long Does it Take to Learn Machine Learning? - Noble Desktop
Is Python enough for ML?,Can I learn ML without AI?,Its syntax is consistent so people learning the language are able to read others' code as well as write their own quite easily. The algorithms and calculations that implementation requires are complex enough with the language used being difficult too. Python's simplicity really lends itself to AI and machine learning.,"https://www.sphereinc.com/blogs/is-python-fast-enough-for-machine-learning/#:~:text=Its%20syntax%20is%20consistent%20so,to%20AI%20and%20machine%20learning.",Is Python Fast Enough for Machine Learning? - Sphere Partners
Is ML difficult to learn?,Can I learn ML without AI?,Factors that make machine learning difficult are the in-depth knowledge of many aspects of mathematics and computer science and the attention to detail one must take in identifying inefficiencies in the algorithm. Machine learning applications also require meticulous attention to optimize an algorithm. 10-Jun-2022,"https://www.coursera.org/articles/is-machine-learning-hard#:~:text=Factors%20that%20make%20machine%20learning,attention%20to%20optimize%20an%20algorithm.",Is Machine Learning Hard? A Guide to Getting Started - Coursera
Can I work in AI without coding?,Can I learn ML without AI?,"Machine Learning without programming is occupying that space and making AI accessible for everyone. This is because you can gain Artificial Intelligence without a single line of code, whether your business is large or small. 16-Nov-2022","https://levity.ai/blog/no-code-machine-learning-guide#:~:text=Machine%20Learning%20without%20programming%20is,business%20is%20large%20or%20small.",No-Code Machine Learning: The Ultimate Guide - Levity AI
Which is the highest paid jobs in IT sector?,What is the salary of AI and ML in India?,Here are some of the highest paying IT jobs in 2023: Data Scientist. Internet of Things (IoT) Solutions Architect. Big Data Engineer. Software Architect. Blockchain Engineer. DevOps Engineer. Cloud Architect. Full-Stack Developer. More items... • 03-Feb-2023,https://www.simplilearn.com/highest-paying-tech-jobs-article,Top Best Paying Jobs in Technology in 2023 - Simplilearn
What is the salary of freshers in machine learning?,What is the salary of AI and ML in India?,Average starting Salary for Machine Learning Engineer in India is around ₹3.0 Lakhs per year (₹25.0k per month).,"https://www.ambitionbox.com/profile/machine-learning-engineer-salary#:~:text=Average%20starting%20Salary%20for%20Machine,%E2%82%B925.0k%20per%20month).",Machine Learning Engineer Salary in India - AmbitionBox
Which IIT is best for artificial intelligence?,What is the salary of AI and ML in India?,"IIT Hyderabad has state of the art computing facilities to foster Artificial Intelligence and Machine Learning research. With multiple collaborations with leading industry partners, we are pushing the boundaries of AI with applications spanning various domains.","https://ai.iith.ac.in/#:~:text=IIT%20Hyderabad%20has%20state%20of,with%20applications%20spanning%20various%20domains.",IIT Hyderabad: Department of Artificial Intelligence (AI)
Which job has highest salary in AI?,What is the salary of machine learning expert in India?,High-Paying Artificial Intelligence Job Profiles in 2021 Director of Analytics. ...  Principal Scientist. ...  Machine Learning Engineer. ...  Computer Vision Engineer. ...  Data Scientist. ...  Data Engineer. ...  Algorithm Engineer. ...  Computer Scientist. ,https://www.analyticsinsight.net/high-paying-artificial-intelligence-job-profiles-in-2021/,High-Paying Artificial Intelligence Job Profiles in 2021 - Analytics Insight
Which field is best for machine learning?,What is the salary of machine learning expert in India?,For Working Professionals. DevOps(Live) ...  For Students. Competitive Programming (Live) ...  Programming Languages. C++ Programming - Beginner to Advanced. ...  Web Development. Full Stack Development with React & Node JS(Live) ...  Machine Learning and Data Science. ...  School Courses. ...  Competitive Programming. Web Development. More items... • 02-Feb-2023,https://www.geeksforgeeks.org/top-career-paths-in-machine-learning/,Top Career Paths in Machine Learning - GeeksforGeeks
Which branch is best for machine learning?,What is the salary of machine learning expert in India?,"Earn a bachelor's degree in computer science or a related field. Because machine learning is part of the computer science field, a strong background in computer programming, data science, and mathematics is essential for success. 08-Nov-2022","https://www.coursera.org/articles/what-is-machine-learning-engineer#:~:text=Earn%20a%20bachelor's%20degree%20in,mathematics%20is%20essential%20for%20success.",What Is a Machine Learning Engineer? (+ How to Get Started)
Can I learn ML without coding?,Can a fresher learn machine learning?,"Traditional Machine Learning requires students to know software programming, which enables them to write machine learning algorithms. But in this groundbreaking Udemy course, you'll learn Machine Learning without any coding whatsoever. As a result, it's much easier and faster to learn!","https://www.udemy.com/course/hands-on-machine-learning-without-writing-code/#:~:text=Traditional%20Machine%20Learning%20requires%20students,easier%20and%20faster%20to%20learn!",Data Science : Master Machine Learning Without Coding - Udemy
What is the salary of ML engineer fresher in India?,Can a fresher learn machine learning?,"The average annual salary of a machine learning engineer is ₹671,548. Machine learning engineers with less than 1-year experience earns around ₹500,000 per annum which is clearly one of the highest entry-level salaries in India. 22-Sept-2022","https://www.upgrad.com/blog/machine-learning-engineer-salary-in-india-freshers-experienced/#:~:text=The%20average%20annual%20salary%20of,entry%2Dlevel%20salaries%20in%20India.",Machine Learning Salary in India in 2023 [For Freshers & Experienced]
Who is eligible for machine learning?,Can a fresher learn machine learning?,"Machine learning engineers are generally expected to have at least a master's degree, and sometimes a Ph. D. in computer science or related fields. Advanced knowledge of mathematics and data analytical skills are critical components of a machine learning engineer's background.","https://www.discoverdatascience.org/career-information/machine-learning-engineer/#:~:text=Machine%20learning%20engineers%20are%20generally,a%20machine%20learning%20engineer's%20background.",How to Become a Machine Learning Engineer – A Complete Career Guide
Does Google hire Python?,What is Python maximum salary?,Full Stack Software Engineer    Experience with one or more general purpose programming languages including but not limited to: Java or Python.,"https://careers.google.com/jobs/results/?employment_type=FULL_TIME&q=python#:~:text=Full%20Stack%20Software%20Engineer&text=Experience%20with%20one%20or%20more,limited%20to%3A%20Java%20or%20Python.",Search Jobs - Google Careers
What is the salary of Python coder in India?,What is Python maximum salary?,"How much do Python developers earn? The average entry-level Python Developer Salary in India is INR 427,293 per annum. The average mid-level Python Developer Salary in India is INR 909,818 per annum, and finally, the average Python Developer Salary in India for experienced folks is INR 1,150,000.","https://www.mygreatlearning.com/blog/python-developer-salary-in-india/#:~:text=How%20much%20do%20Python%20developers,experienced%20folks%20is%20INR%201%2C150%2C000.",Python Developer Salary In India 2023 - Great Learning
Which pays more Java or Python?,What is Python maximum salary?,"Salary and Jobs    In India, the average salary for a Java developer is ₹4,55,000 per annum(Source: Glassdoor) and for a Python developer, it is ₹4,46,000 per annum(Source: Glassdoor). So if you become flawless in Java or Python, you can easily start your career as a developer. 30-Nov-2022","https://codedamn.com/news/programming/python-vs-java-difference#:~:text=Salary%20and%20Jobs,-It%20doesn't&text=In%20India%2C%20the%20average%20salary,your%20career%20as%20a%20developer.","Python vs Java: Difference in performance, salaries and more"
Which Python career is best?,What is the salary of Python in India?,"Web developer with Python skills can also earn in the range of Rs 8,00,000 per annum. Other related job roles include lead software engineer (up to Rs 2,000,000 per annum), data scientist (Rs 7,00,000 per annum), machine learning engineer (Rs 6,70,000 per annum), data analyst (4,17,000 per annum), and more. 21-Sept-2022","https://www.upgrad.com/blog/career-opportunities-in-python/#:~:text=Web%20developer%20with%20Python%20skills,per%20annum)%2C%20and%20more.",Career Opportunities in Python: Everything You Need To Know [2023]
What is the salary of Python developer in TCS?,What is the salary of Python in India?,Salaries at Similar Companies    TCS Senior Python Developer salary in India ranges between ₹ 6.1 Lakhs to ₹ 22.0 Lakhs with an average annual salary of ₹ 12.6 Lakhs. Salary estimates are based on 13 TCS latest salaries received from various employees of TCS.,"https://www.ambitionbox.com/salaries/tcs-salaries/senior-python-developer#:~:text=Salaries%20at%20Similar%20Companies&text=TCS%20Senior%20Python%20Developer%20salary%20in%20India%20ranges%20between%20%E2%82%B9,from%20various%20employees%20of%20TCS.",TCS Senior Python Developer Salaries in India - AmbitionBox
Which country is best for Python jobs?,What is the salary of Python in India?,"The average Python Developer Salary in Germany     Being the most innovative and competitive country in the world, Germany is a technological powerhouse. According to a recent survey, 50% of all of Germany's startups are based in Berlin.","https://ddi-dev.com/blog/programming/average-python-developer-salary-in-the-usa-europe-and-other-world-countries/#:~:text=The%20average%20Python%20Developer%20Salary%20in%20Germany,startups%20are%20based%20in%20Berlin.","What's the Average Python Developer Salary in the USA, Europe and in ..."
Is 40 too old to learn Python?,Can I master Python in 3 years?,"Let's get this out of the way: no, you are not too old to program. There isn't an age limit on learning to code, and there never was. But all too often, insecurity and uncertainty compel older adults to put a ceiling on their achievement potential.","https://bootcamp.cvn.columbia.edu/blog/learn-programming-when-older/#:~:text=Let's%20get%20this%20out%20of,ceiling%20on%20their%20achievement%20potential.",How to Learn Programming If You're Older (Step by Step)
What is the salary if we learn Python?,Can I master Python in 3 years?,"Glassdoor. According to Python Developer Salary data from Glassdoor mid-level Python Developers earn an average of $101,920 annually in 2023 up from $100,000 in 2022. In contrast, Senior Python Developers take home a salary of at least $163,000 per year.","https://bluelight.co/blog/the-complete-python-developer-salary-guide#:~:text=%E2%80%8D-,Glassdoor,at%20least%20%24163%2C000%20per%20year.",The Complete Python Developer Salary Guide for 2023
Which degree is best for Python?,Can I master Python in 3 years?,Earning a degree in computer science is a great place to start if you're considering becoming a Python developer. Most computer programmers have at least a bachelor's degree in computer science or a related field.,"https://www.wgu.edu/career-guide/information-technology/python-programmer-career.html#:~:text=Earning%20a%20degree%20in%20computer,science%20or%20a%20related%20field.",How to Become a Python Programmer - Western Governors University
Which programming has highest salary?,What is the highest salary of machine learning in India?,"10 Highest-Paying Programming Languages in 2023 Objective-C. Average Base Salary: $125,247. ...  Kotlin. Average Base Salary: $130,497. ...  Ruby on Rails. Average Base Salary: $127,763. ...  Perl. Average Base Salary: $117,595. ...  C# Average Base Salary: $108,902. ...  Python. Average Base Salary: $116,394. ...  Java. Average Base Salary: $106,066. ...  Swift. More items... • 12-Dec-2022",https://emeritus.org/blog/coding-highest-paying-programing-languages/,The Top 10 Highest-Paying Programming Languages to Learn
What is the highest paying coding job in India?,What is the highest salary of machine learning in India?,Top 10 Highest Paid Jobs in IT Sector in 2023 Big Data Engineer. Machine Learning Engineer. AI/ML Architect. IoT Solutions Architect. Cloud Architect. Blockchain Developer. Full Stack Developer. AR/VR Developer. More items... • 02-Jan-2023,https://www.naukri.com/learning/articles/top-highest-paid-jobs-it-sector/,Top 10 Highest Paid Jobs in IT Sector in 2023 | Naukri Learning
What is the job scope of machine learning?,What is the highest salary of machine learning in India?,"As a machine learning engineer, working in this branch of artificial intelligence, you'll be responsible for creating programmes and algorithms that enable machines to take actions without being directed. An example of a system you may produce is a self-driving car or a customised newsfeed.","https://www.prospects.ac.uk/job-profiles/machine-learning-engineer#:~:text=As%20a%20machine%20learning%20engineer,car%20or%20a%20customised%20newsfeed.",Machine learning engineer job profile | Prospects.ac.uk
What is the salary of ML scientist in India?,What is the highest paying ML job?,Machine Learning Scientist - Big Data/NLP salary in India ranges between ₹ 5.2 Lakhs to ₹ 52.0 Lakhs with an average annual salary of ₹ 15.0 Lakhs.,"https://www.ambitionbox.com/profile/machine-learning-scientist-big-data-or-nlp-salary#:~:text=Machine%20Learning%20Scientist%20%2D%20Big%20Data%2FNLP%20salary%20in%20India%20ranges,salary%20of%20%E2%82%B9%2015.0%20Lakhs.",Machine Learning Scientist - Big Data/NLP Salary in India
How do freshers get ML jobs?,What is the highest paying ML job?,"How to land into Data Science and Machine Learning Job as a... Machine Learning. Natural Language Processing. Computer Vision. Time series. Audio and Video analytics After identifying your interest, Learn some important concepts in that domain and most important one important thing is you should be good at basics. ",https://www.kaggle.com/general/179537,How to land into Data Science and Machine Learning Job as a Fresher
What is the scope of ML in India?,What is the highest paying ML job?,"Machine learning applications include a range of state-of-the-art applications such as speech recognition, computer vision, customer service, the healthcare sector, stock trading, etc. Along with that, ML is expected to greatly impact industries such as robotics, quantum computing, automotive and cyber security. 05-Sept-2022","https://www.upgrad.com/blog/highest-paying-machine-learning-jobs-india/#:~:text=Machine%20learning%20applications%20include%20a,computing%2C%20automotive%20and%20cyber%20security.",Top 10 Highest Paying Machine Learning Jobs in India [A Complete ...
Is machine learning jobs in demand in India?,What is future scope of machine learning?,"The demand for Machine Learning engineers is always high, and many companies require individuals with the necessary skills to perform their jobs. Due to the increasing demand, the average salary of machine learning engineer in India has become quite high. 03-Dec-2022","https://www.careers360.com/careers/articles/machine-learning-salary-in-india#:~:text=The%20demand%20for%20Machine%20Learning,India%20has%20become%20quite%20high.",Machine Learning Salary in India (Fresher & Experienced}
Is machine learning high paying job?,What is future scope of machine learning?,"Machine learning engineers with less than a year of experience earn about 500,000 per year, making them one of India's top entry-level wages. 29-Jan-2023","https://www.simplilearn.com/machine-learning-salary-article#:~:text=Machine%20learning%20engineers%20with%20less,India's%20top%20entry%2Dlevel%20wages.",Machine Learning Salary: Trends Moving Into 2023 | Simplilearn
Which country has scope for machine learning?,What is future scope of machine learning?,Best Countries for Artificial Intelligence Jobs    India. Germany. Canada. United Kingdom (UK),"https://www.simplilearn.com/ai-engineer-salary-article#:~:text=Best%20Countries%20for%20Artificial%20Intelligence%20Jobs,-The%20top%207&text=Europe-,India,United%20Kingdom%20(UK)","AI Engineer Salary in 2023: US, India, Canada and More - Simplilearn"
What is the highest paid ML engineer?,Is machine learning in demand in India?,"The highest salary of an ML engineer in India is around INR 20,00,000 annually. However, their salaries vary depending on the factors such as experience level, location, and skills.","https://www.projectpro.io/article/machine-learning-engineer-salary-the-ultimate-guide-for-2021/411#:~:text=The%20highest%20salary%20of%20an,level%2C%20location%2C%20and%20skills.",Machine Learning Engineer Salary-The Ultimate Guide for 2023
What is future scope of machine learning?,Is machine learning in demand in India?,"A look at the scope of machine learning jobs and their salaries: Machine Learning in India and around the world has a much higher potential than other career disciplines when it comes to work prospects. It is predicted that by 2022, there will be 2.3 million jobs in the field of AI and ML. 16-Aug-2022","https://www.linkedin.com/pulse/future-scope-machine-learning-one-finest-careers-varuna-chauhan?trk=pulse-article_more-articles_related-content-card#:~:text=A%20look%20at%20the%20scope,field%20of%20AI%20and%20ML.",Future Scope in Machine Learning: One of the finest careers - LinkedIn
Which institute is best for machine learning in India?,Is machine learning in demand in India?,"Top AI institutions and programs in India Indian Institute of Science Education and Research, Bhopal. ...  Gujarat University, Ahmedabad. ...  Cochin University of Science and Technology, Kochi. ...  PSG College of Technology, Coimbatore. ...  Jain University, Bangalore. ...  Amity School of Engineering and Technology. ...  Chandigarh University. More items... • 08-Jul-2022",https://indiaai.gov.in/article/top-ai-institutions-and-programs-in-india,Top AI institutions and programs in India - INDIAai
What is the salary of AI and ML in India?,Is machine learning a good career in India?,Ai Ml Engineer salary in India ranges between ₹ 3.7 Lakhs to ₹ 22.1 Lakhs with an average annual salary of ₹ 7.0 Lakhs.,"https://www.ambitionbox.com/profile/ai-ml-engineer-salary/it-services-and-consulting-industry#:~:text=Ai%20Ml%20Engineer%20salary%20in%20India%20ranges%20between%20%E2%82%B9%203.7,salary%20of%20%E2%82%B9%207.0%20Lakhs.","Ai Ml Engineer Salary in IT Services & Consulting Companies, India"
What is the salary of machine learning expert?,Is machine learning a good career in India?,"How much does a Machine Learning Specialist make? The national average salary for a Machine Learning Specialist is ₹6,45,500 in India.","https://www.glassdoor.co.in/Salaries/machine-learning-specialist-salary-SRCH_KO0,27.htm#:~:text=How%20much%20does%20a%20Machine,%E2%82%B96%2C45%2C500%20in%20India.","Salary: Machine Learning Specialist (February, 2023) - Glassdoor"
What is a machine learning salary?,Is machine learning a good career in India?,"The average salary for a machine learning engineer is $150,961 per year in the United States. 3.1k salaries reported, updated at January 29, 2023.","https://www.indeed.com/career/machine-learning-engineer/salaries#:~:text=The%20average%20salary%20for%20a,updated%20at%20January%2029%2C%202023",Machine learning engineer salary in United States - Indeed
What is the salary of AI engineer in India?,Does machine learning have a future in India?,AI Engineer salary in India with less than 1 year of experience to 7 years ranges from ₹ 3 Lakhs to ₹ 20 Lakhs with an average annual salary of ₹ 7.8 Lakhs based on 355 latest salaries.,"https://www.ambitionbox.com/profile/ai-engineer-salary#:~:text=AI%20Engineer%20salary%20in%20India%20with%20less%20than%201%20year,based%20on%20355%20latest%20salaries.",AI Engineer Salary in India - AmbitionBox
Which is best for future AI or ML?,Does machine learning have a future in India?,If you want to go for research work then preferably the field of data science is the one for you. If you want to become an engineer and want to create intelligence into software products then machine learning or more preferably AI is the best path to take.,"https://www.analyticsinsight.net/ai-ml-or-data-science-which-is-the-best-path-to-take/#:~:text=If%20you%20want%20to%20go,the%20best%20path%20to%20take.","AI, ML or Data Science? Which is the Best Path to Take? - Analytics Insight"
