PAA Title,Parent,Text,URL,URL Title
What exactly is machine learning?,machine learning,"   What is machine learning? Machine learning is a subfield of artificial intelligence, which is broadly defined as the capability of a machine to imitate intelligent human behavior. Artificial intelligence systems are used to perform complex tasks in a way that is similar to how humans solve problems. 21-Apr-2021","https://mitsloan.mit.edu/ideas-made-to-matter/machine-learning-explained#:~:text=What%20is%20machine%20learning%3F,to%20how%20humans%20solve%20problems.","Machine learning, explained | MIT Sloan"
What are the 3 types of machine learning?,machine learning,"The three machine learning types are supervised, unsupervised, and reinforcement learning. 14-Sept-2022","https://www.coursera.org/articles/types-of-machine-learning#:~:text=The%20three%20machine%20learning%20types,%2C%20unsupervised%2C%20and%20reinforcement%20learning.",3 Types of Machine Learning You Should Know | Coursera
What are the 4 basics of machine learning?,machine learning,"   Machine Learning techniques are divided mainly into the following 4 categories: Supervised Learning. Supervised learning is applicable when a machine has sample data, i.e., input as well as output data with correct labels. ...  Unsupervised Learning. ...  Reinforcement Learning. ...  Semi-supervised Learning. ",https://www.javatpoint.com/basic-concepts-in-machine-learning,Basic Concepts in Machine Learning - Javatpoint
What is machine learning with example?,machine learning,"Machine learning is a modern innovation that has enhanced many industrial and professional processes as well as our daily lives. It's a subset of artificial intelligence (AI), which focuses on using statistical techniques to build intelligent computer systems to learn from available databases. 09-Sept-2021","https://www.salesforce.com/eu/blog/2020/06/real-world-examples-of-machine-learning.html#:~:text=Machine%20learning%20is%20a%20modern,to%20learn%20from%20available%20databases.",6 Real-World Examples of Machine Learning - Salesforce Blog
What is the best language for machine learning?,What exactly is machine learning?,"It is regarded as the best for data science, sentiment analysis, natural language processing, and data science prototyping. Python is considered the best language for machine learning by a lot of coding experts. 17-Nov-2022","https://dataconomy.com/2022/11/best-language-for-machine-learning/#:~:text=It%20is%20regarded%20as%20the,a%20lot%20of%20coding%20experts.",Best Language For Machine Learning In 2022: Is It Python? - Dataconomy
What is difference between machine learning and AI?,What exactly is machine learning?,"An “intelligent” computer uses AI to think like a human and perform tasks on its own. Machine learning is how a computer system develops its intelligence. One way to train a computer to mimic human reasoning is to use a neural network, which is a series of algorithms that are modeled after the human brain.","https://azure.microsoft.com/en-in/solutions/ai/artificial-intelligence-vs-machine-learning/#:~:text=An%20%E2%80%9Cintelligent%E2%80%9D%20computer%20uses%20AI,modeled%20after%20the%20human%20brain.",Artificial intelligence (AI) vs. machine learning (ML) - Microsoft Azure
Which algorithm is used in machine learning?,What are the 3 types of machine learning?,Decision Tree algorithm in machine learning is one of the most popular algorithm in use today; this is a supervised learning algorithm that is used for classifying problems. It works well in classifying both categorical and continuous dependent variables. 30-Jan-2023,"https://www.simplilearn.com/10-algorithms-machine-learning-engineers-need-to-know-article#:~:text=Decision%20Tree%20algorithm%20in%20machine,categorical%20and%20continuous%20dependent%20variables.",Top 10 Machine Learning Algorithms You Need to Know in 2023
What are the 7 steps of machine learning?,What are the 3 types of machine learning?,The 7 Steps of Machine Learning Data Collection. → The quantity & quality of your data dictate how accurate our model is. ...  Data Preparation. → Wrangle data and prepare it for training. ...  Choose a Model. ...  Train the Model. ...  Evaluate the Model. ...  Parameter Tuning. ...  Make Predictions. 19-Oct-2022,https://www.kdnuggets.com/2018/05/general-approaches-machine-learning-process.html,Frameworks for Approaching the Machine Learning Process
What are the 3 C's of machine learning?,What are the 3 types of machine learning?,"Any Intelligent system has three major components of intelligence, one is Comparison, two is Computation and three is Cognition. These three C's in the process of any intelligent action is a sequential process. 16-Feb-2020","https://www.linkedin.com/pulse/three-cs-artificial-intelligence-sudhakaran-srambikal#:~:text=Any%20Intelligent%20system%20has%20three,action%20is%20a%20sequential%20process.",The Three C's of Artificial Intelligence - LinkedIn
What are the 2 types of learning ML?,What are the 4 basics of machine learning?,"There are primarily three types of machine learning: Supervised, Unsupervised, and Reinforcement Learning. Let's explore and understand the different types of machine learning one by one. 02-Feb-2023","https://www.simplilearn.com/tutorials/machine-learning-tutorial/types-of-machine-learning#:~:text=There%20are%20primarily%20three%20types,machine%20learning%20one%20by%20one.",Types of Machine Learning | Simplilearn
What are 2 main types of machine learning algorithm?,What are the 4 basics of machine learning?,"There are four types of machine learning algorithms: supervised, semi-supervised, unsupervised and reinforcement.","https://www.sas.com/en_gb/insights/articles/analytics/machine-learning-algorithms.html#:~:text=There%20are%20four%20types%20of,%2Dsupervised%2C%20unsupervised%20and%20reinforcement.",A guide to the types of machine learning algorithms | SAS UK
What are the 2 types of machine learning *?,What are the 4 basics of machine learning?,The four different types of machine learning are: Supervised Learning. Unsupervised Learning. Semi-Supervised Learning. Reinforced Learning. 05-Aug-2022,https://emeritus.org/blog/types-of-machine-learning/,4 Types of Machine Learning and How to Build a Great Career in Each
What is ML in simple words?,What is machine learning with example?,Machine learning (ML) is a type of artificial intelligence (AI) that allows software applications to become more accurate at predicting outcomes without being explicitly programmed to do so.,"https://www.techtarget.com/searchenterpriseai/definition/machine-learning-ML#:~:text=Machine%20learning%20(ML)%20is%20a,explicitly%20programmed%20to%20do%20so.",What Is Machine Learning and Why Is It Important? - TechTarget
Where machine learning is used?,What is machine learning with example?,"Machine learning is used in internet search engines, email filters to sort out spam, websites to make personalised recommendations, banking software to detect unusual transactions, and lots of apps on our phones such as voice recognition.","https://royalsociety.org/topics-policy/projects/machine-learning/videos-and-background-information/#:~:text=Machine%20learning%20is%20used%20in,phones%20such%20as%20voice%20recognition.",What is machine learning? | Royal Society
Why is machine learning used?,What is machine learning with example?,"Simply put, machine learning allows the user to feed a computer algorithm an immense amount of data and have the computer analyze and make data-driven recommendations and decisions based on only the input data.","https://www.netapp.com/artificial-intelligence/what-is-machine-learning/#:~:text=Simply%20put%2C%20machine%20learning%20allows,on%20only%20the%20input%20data.",What Is Machine Learning - ML - and Why Is It Important? - NetApp
Does machine learning require coding?,What is the best language for machine learning?,"Yes, if you're looking to pursue a career in artificial intelligence and machine learning, a little coding is necessary.","https://brainstation.io/career-guides/does-machine-learning-require-coding#:~:text=Yes%2C%20if%20you're%20looking,a%20little%20coding%20is%20necessary.",Does Machine Learning Require Coding? (2023 Guide) - BrainStation
Does machine learning require math?,What is the best language for machine learning?,"Math is a fundamental component of machine learning, which aids in developing an algorithm that can learn from data and make precise predictions. 22-Jul-2022","https://www.byjusfutureschool.com/blog/what-kind-of-math-is-necessary-for-machine-learning/#:~:text=Math%20is%20a%20fundamental%20component,data%20and%20make%20precise%20predictions.",What Kind of Math is Necessary for Machine Learning?
How do I start learning ML?,What is the best language for machine learning?,   Learn Machine Learning in 9 Easy Steps Learn the Prerequisites. Learn ML Theory From A to Z. Deep Dive Into the Essential Topics. Work on Projects. Learn and Work With Different ML Tools. Study ML Algorithms From Scratch. Opt For a Machine Learning Course. Apply for an Internship. More items... • 11-Mar-2022,https://www.springboard.com/blog/data-science/how-to-learn-machine-learning/,How To Learn Machine Learning From Scratch [2023 Guide]
Which is better Python or machine learning?,What is difference between machine learning and AI?,"The Python programming language attracts a huge community of developers, which makes it a preferred programming language for machine learning and other projects, such as data analysis, regression, web development, etc. 19-Jan-2023","https://corporatefinanceinstitute.com/resources/knowledge/other/python-in-machine-learning/#:~:text=The%20Python%20programming%20language%20attracts,regression%2C%20web%20development%2C%20etc.","Python (Machine Learning) - Overview, Advantages"
Should I learn AI first or ML?,What is difference between machine learning and AI?,"Otherwise, it would be better for you to start out with machine learning since there is a lot of free material around for you to learn from and it is very high in demand right now. Machine learning is actually considered as a subset of artificial intelligence.","https://www.kaggle.com/general/168594#:~:text=Otherwise%2C%20it%20would%20be%20better,a%20subset%20of%20artificial%20intelligence.",What should I learn first Machine Learning or Artificial Intelligence
Which is better AI or ML?,What is difference between machine learning and AI?,AI has a very wide range of scope. Machine learning has a limited scope. AI is working to create an intelligent system which can perform various complex tasks. Machine learning is working to create machines that can perform only those specific tasks for which they are trained.,"https://www.javatpoint.com/difference-between-artificial-intelligence-and-machine-learning#:~:text=AI%20has%20a%20very%20wide,for%20which%20they%20are%20trained.",Difference between Artificial intelligence and Machine learning
What are the 3 algorithms?,Which algorithm is used in machine learning?,"An algorithm is made up of three basic building blocks: sequencing, selection, and iteration.","https://www.khanacademy.org/computing/ap-computer-science-principles/algorithms-101/building-algorithms/a/the-building-blocks-of-algorithms#:~:text=An%20algorithm%20is%20made%20up,sequencing%2C%20selection%2C%20and%20iteration.","Sequencing, selection, and iteration | AP CSP (article) - Khan Academy"
What is ML and its types?,Which algorithm is used in machine learning?,"   As explained, machine learning algorithms have the ability to improve themselves through training. Today, ML algorithms are trained using three prominent methods. These are three types of machine learning: supervised learning, unsupervised learning, and reinforcement learning. 13-Dec-2019","https://www.potentiaco.com/what-is-machine-learning-definition-types-applications-and-examples/#:~:text=As%20explained%2C%20machine%20learning%20algorithms,unsupervised%20learning%2C%20and%20reinforcement%20learning.","What Is Machine Learning: Definition, Types, Applications and Examples"
What is an example of ML model?,Which algorithm is used in machine learning?,"Some popular examples of machine learning algorithms include linear regression, decision trees, random forest, and XGBoost.","https://www.databricks.com/glossary/machine-learning-models#:~:text=Some%20popular%20examples%20of%20machine,%2C%20random%20forest%2C%20and%20XGBoost.",What are Machine Learning Models? - Databricks
What are the three phases of ML?,What are the 7 steps of machine learning?,"   Machine Learning (ML) is used in Artificial Intelligence (AI) as well as in Analytics and Data Science. There are three types of machine learning: Supervised Learning, Unsupervised Learning and Reinforcement Learning. 22-Jan-2020","https://www.spiria.com/en/blog/artificial-intelligence/the-3-vital-steps-of-machine-learning/#:~:text=Machine%20Learning%20(ML)%20is%20used,Unsupervised%20Learning%20and%20Reinforcement%20Learning.",The 3 main steps of Machine Learning | Spiria
What is the ML lifecycle?,What are the 7 steps of machine learning?,   The machine learning life cycle is the cyclical process that data science projects follow. It defines each step that an organization should follow to take advantage of machine learning and artificial intelligence (AI) to derive practical business value.,"https://www.datarobot.com/wiki/machine-learning-life-cycle/#:~:text=The%20machine%20learning%20life%20cycle%20is%20the%20cyclical%20process%20that,to%20derive%20practical%20business%20value.",Machine Learning Life Cycle - DataRobot AI Platform Wiki
Which programming language is used for AI?,What are the 3 C's of machine learning?,"Python and Java are both languages that are widely used for AI. The choice between the programming languages depends on how you plan to implement AI. For example, in the case of data analysis, you would probably go with Python.","https://www.bairesdev.com/blog/top-6-languages-for-artificial-intelligence/#:~:text=Python%20and%20Java%20are%20both,would%20probably%20go%20with%20Python.",Top 9 Programming Languages For Artificial Intelligence - BairesDev
What are the main challenges in machine learning?,What are the 3 C's of machine learning?,   Here are five common machine learning problems and how you can overcome them. 1) Understanding Which Processes Need Automation. ...  2) Lack of Quality Data. ...  3) Inadequate Infrastructure. ...  4) Implementation. ...  5) Lack of Skilled Resources. 19-Apr-2022,https://www.provintl.com/blog/5-common-machine-learning-problems-how-to-beat-them,5 Common Machine Learning Problems & How to Solve Them
What is deep learning vs machine learning?,What are the 3 C's of machine learning?,"Machine learning and deep learning are both types of AI. In short, machine learning is AI that can automatically adapt with minimal human interference. Deep learning is a subset of machine learning that uses artificial neural networks to mimic the learning process of the human brain. 11-Aug-2022","https://www.coursera.org/articles/ai-vs-deep-learning-vs-machine-learning-beginners-guide#:~:text=Machine%20learning%20and%20deep%20learning,process%20of%20the%20human%20brain.",Deep Learning vs. Machine Learning: Beginner's Guide - Coursera
What are the 4 learning types?,What are the 2 types of learning ML?,"There are 4 predominant learning styles: Visual, Auditory, Read/Write, and Kinaesthetic. While most of us may have some general idea about how we learn best, often it comes as a surprise when we discover what our predominant learning style is.",https://web.wlu.ca/learning_resources/pdfs/Learning_Styles.pdf,Learning Styles
What is step 5 in machine learning?,What are 2 main types of machine learning algorithm?,"5. Train Model. Now the next step is to train the model, in this step we train our model to improve its performance for better outcome of the problem. We use datasets to train the model using various machine learning algorithms.","https://www.javatpoint.com/machine-learning-life-cycle#:~:text=5.,using%20various%20machine%20learning%20algorithms.",Life cycle of Machine Learning - Javatpoint
How many data types are there in machine learning?,What are 2 main types of machine learning algorithm?,"   Data can come in many forms, but machine learning models rely on four primary data types. These include numerical data, categorical data, time series data, and text data.","https://www.datarobot.com/blog/the-importance-of-machine-learning-data/#:~:text=Data%20can%20come%20in%20many,series%20data%2C%20and%20text%20data.",The importance of machine learning data - DataRobot AI Platform
What are the 5 algorithms?,What are 2 main types of machine learning algorithm?,"   Decision Tree Algorithm, Support Vector Method Algorithm, Logistic Regression, K-means Clustering Algorithm, and Naïve Bayesian classification, are 5 basic ML algorithms.","https://becominghuman.ai/5-machine-learning-algorithms-every-data-scientists-should-learn-de467fd2e444#:~:text=Decision%20Tree%20Algorithm%2C%20Support%20Vector,are%205%20basic%20ML%20algorithms.",Top 5 Algorithms Machine Learning Engineers Should Learn in 2022
What is the difference between machine learning and algorithm?,What are the 2 types of machine learning *?,"To summarize: algorithms are automated instructions and can be simple or complex, depending on how many layers deep the initial algorithm goes. Machine learning and artificial intelligence are both sets of algorithms, but differ depending on whether the data they receive is structured or unstructured.","https://www.quinyx.com/blog/difference-between-ai-ml-algorithms#:~:text=To%20summarize%3A%20algorithms%20are%20automated,receive%20is%20structured%20or%20unstructured.","What's The Difference Between AI, ML, and Algorithms? - Quinyx"
What is the algorithm of AI?,What are the 2 types of machine learning *?,"So then what is an AI algorithm? The definition of an algorithm is “a set of instructions to be followed in calculations or other operations.” This applies to both mathematics and computer science. So, at the essential level, an AI algorithm is the programming that tells the computer how to learn to operate on its own.","https://www.tableau.com/data-insights/ai/algorithms#:~:text=So%20then%20what%20is%20an,to%20operate%20on%20its%20own.",Artificial intelligence (AI) algorithms: a complete overview | Tableau
Who invented machine learning?,What is ML in simple words?,"   One of its own, Arthur Samuel, is credited for coining the term, “machine learning” with his research (PDF, 492 KB) (link resides outside IBM) around the game of checkers. 15-Jul-2020","https://www.ibm.com/in-en/cloud/learn/machine-learning#:~:text=One%20of%20its%20own%2C%20Arthur,around%20the%20game%20of%20checkers.",What is Machine Learning? - India - IBM
What is the simplest machine learning?,What is ML in simple words?,K-means clustering     K-means clustering is one of the simplest and a very popular unsupervised machine learning algorithms. 15-Jan-2020,"https://towardsdatascience.com/top-10-algorithms-for-machine-learning-beginners-149374935f3c#:~:text=K%2Dmeans%20clustering,popular%20unsupervised%20machine%20learning%20algorithms.",Top 9 Algorithms for a Machine Learning Beginner | by Rashi Desai
What is machine learning language?,What is ML in simple words?,"Machine learning is a branch of artificial intelligence (AI) and computer science which focuses on the use of data and algorithms to imitate the way that humans learn, gradually improving its accuracy. IBM has a rich history with machine learning.","https://www.ibm.com/topics/machine-learning#:~:text=Machine%20learning%20is%20a%20branch,rich%20history%20with%20machine%20learning.",What is Machine Learning? | IBM
Is SQL used in machine learning?,Where machine learning is used?,"Machine Learning Services is a feature in SQL Server that gives the ability to run Python and R scripts with relational data. You can use open-source packages and frameworks, and the Microsoft Python and R packages, for predictive analytics and machine learning. 18-Nov-2022","https://learn.microsoft.com/en-us/sql/machine-learning/sql-server-machine-learning-services#:~:text=Machine%20Learning%20Services%20is%20a,predictive%20analytics%20and%20machine%20learning.",What is SQL Server Machine Learning Services (Python and R)?
Why Python is mostly used in machine learning?,Where machine learning is used?,It is easier to understand and this helps to easily create machine learning models. Another feature of Python is that it is intuitive and is perfect for a collaborative deployment. It allows faster prototyping and product testing as it is a general-purpose language. 26-Sept-2022,"https://www.naukri.com/learning/articles/why-python-for-machine-learning-is-important/#:~:text=It%20is%20easier%20to%20understand,is%20a%20general%2Dpurpose%20language.",Why Python for Machine Learning is Important? - Naukri.com
Where is C++ used in machine learning?,Where machine learning is used?,"C++ is more efficient than most other languages. You can control every single resource starting from memory, CPU, and many other things. Most frameworks are implemented in C++under the hood, like TensorFlow, Caffe, Vowpal, wabbit and libsvm. Learning machine learning in C++ makes you a very desirable hire target.","https://medium.com/ml2b/when-should-you-learn-machine-learning-using-c-6edd719f95ff#:~:text=C%2B%2B%20is%20more%20efficient%20than,a%20very%20desirable%20hire%20target.",When Should You Learn Machine Learning using C++? - Medium
Why is it called machine learning?,Why is machine learning used?,"The term “machine learning” was coined by Arthur Samuel, a computer scientist at IBM and a pioneer in AI and computer gaming. Samuel designed a computer program for playing checkers. The more the program played, the more it learned from experience, using algorithms to make predictions. 14-Mar-2022","https://www.expert.ai/blog/machine-learning-definition/#:~:text=The%20term%20%E2%80%9Cmachine%20learning%E2%80%9D%20was,using%20algorithms%20to%20make%20predictions.",What Is Machine Learning? A Definition. - Expert.ai
Can I learn AI in 3 months?,Does machine learning require coding?,Artificial Intelligence    The real world projects from the industry experts would definitely give all the course takers to become a practical expert for the field of AI for Robotics. The course usually takes 2.5 to 3 months to complete and can be easily done along with a full-time job!,"https://towardsdatascience.com/top-5-courses-that-can-make-you-an-ai-ml-expert-within-6-months-53af64c26d73#:~:text=Artificial%20Intelligence,-Nanodegree%20Program%20Prerequisite&text=The%20real%20world%20projects%20from,with%20a%20full%2Dtime%20job!",Top 5 courses that can make you an AI/ML expert within 6 months
Is Python enough for ML?,Does machine learning require coding?,Its syntax is consistent so people learning the language are able to read others' code as well as write their own quite easily. The algorithms and calculations that implementation requires are complex enough with the language used being difficult too. Python's simplicity really lends itself to AI and machine learning.,"https://www.sphereinc.com/blogs/is-python-fast-enough-for-machine-learning/#:~:text=Its%20syntax%20is%20consistent%20so,to%20AI%20and%20machine%20learning.",Is Python Fast Enough for Machine Learning? - Sphere Partners
What skills do you need for machine learning?,Does machine learning require coding?,"   Machine learning involves computation on large data sets; hence one should possess strong basic fundamental skills such as computer architecture, algorithms, data structures, complexity, etc. Getting in-depth into the programming books and exploring new things will be a good advantage.","https://mindmajix.com/what-skills-needed-for-machine-learning-jobs#:~:text=Machine%20learning%20involves%20computation%20on,will%20be%20a%20good%20advantage.",Skills Need to Become a Machine Learning Engineer - MindMajix
Is C++ required for machine learning?,Does machine learning require math?,"C++ can make your machine learning models run faster and more efficiently. This handy guide will help you learn the fundamentals of machine learning (ML), showing you how to use C++ libraries to get the most out of your data.","https://www.packtpub.com/product/hands-on-machine-learning-with-c/9781789955330#:~:text=C%2B%2B%20can%20make%20your%20machine,most%20out%20of%20your%20data.",Hands-On Machine Learning with C++ - Packt
Which is best R or Python?,Does machine learning require math?,"Python is a general-purpose programming language, while R is a statistical programming language. This means that Python is more versatile and can be used for a wider range of tasks, such as web development, data manipulation, and machine learning.","https://www.datacamp.com/blog/python-vs-r-for-data-science-whats-the-difference#:~:text=Python%20is%20a%20general%2Dpurpose%20programming%20language%2C%20while%20R%20is,data%20manipulation%2C%20and%20machine%20learning.",Python vs R for Data Science: Which Should You Learn? - DataCamp
How difficult is machine learning?,Does machine learning require math?,Factors that make machine learning difficult are the in-depth knowledge of many aspects of mathematics and computer science and the attention to detail one must take in identifying inefficiencies in the algorithm. Machine learning applications also require meticulous attention to optimize an algorithm. 10-Jun-2022,"https://www.coursera.org/articles/is-machine-learning-hard#:~:text=Factors%20that%20make%20machine%20learning,attention%20to%20optimize%20an%20algorithm.",Is Machine Learning Hard? A Guide to Getting Started - Coursera
