PAA Title,Parent,Text,URL,URL Title
Which country is best for studying AI?,Is SQL a machine language?,Best countries to study artificial intelligence Artificial Intelligence in Canada. Artificial Intelligence in USA. Artificial Intelligence in Germany. Artificial Intelligence in Sweden. Artificial Intelligence in Ireland. Artificial Intelligence in Belgium. Artificial Intelligence in France. Artificial Intelligence in Spain. More items...,https://studee.com/subjects/artificial-intelligence/,"Study Artificial Intelligence Abroad - Top Universities for Masters, MBA ..."
What is the IQ level of AI?,Is SQL a machine language?,"   At the maximum, these AI reached an IQ value of about 47, which corresponds approximately to a six-year-old child in first grade. An adult comes to about 100 on average.","https://en.wikipedia.org/wiki/Artificial_general_intelligence#:~:text=At%20the%20maximum%2C%20these%20AI,to%20about%20100%20on%20average.",Artificial general intelligence - Wikipedia
Is AI mostly math?,Is SQL a machine language?,"   Is AI mostly math? Yes, especially linear algebra, probability, and calculus are currently used by AI. The topics necessary are all compiled, alongside computer programming, to create AI at its core. 18-Mar-2022","https://insights.gostudent.org/ca/how-is-math-used-in-artificial-intelligence#:~:text=produced%20by%20machines.-,Is%20AI%20mostly%20math%3F,create%20AI%20at%20its%20core.",How Is Math Used in Artificial Intelligence? | GoStudent
Which is best IIT for artificial intelligence?,Can I learn ML without coding?,Both the subject is equivalently good but AI has more scope . 28-Oct-2020,https://www.careers360.com/question-please-tell-me-which-is-better-computer-science-with-artificial-intelligence-or-information-technology-only-if-i-am-getting-both-then-what-should-i-opt-for-please-tell-me-i-am-very-confused-about-this#:~:text=Both%20the%20subject%20is%20equivalently%20good%20but%20AI%20has%20more%20scope%20.,PLEASE TELL ME .Which is better Computer Science With Artificial ...
In which IIT AI course is best?,Can I learn ML without coding?,This article features the top 10 best artificial intelligence and machine learning courses offered by IITs. B. ...  Certificate Program in Machine Learning and AI using Python – IIT Bombay. ...  M. ...  Post Baccalaureates in AI and Data Science – IIT Madras. ...  Ph. ...  Certificate Programme in Data Science & Machine Learning – IIT Delhi. More items... • 04-Jun-2022,https://www.analyticsinsight.net/top-10-artificial-intelligence-and-machine-learning-courses-offered-by-iits/,Top 10 Artificial Intelligence and Machine Learning Courses Offered ...
Which company is best for AI in India?,Can I learn ML without coding?,   Best AI Stocks in India Tata Elxsi Ltd. Bosch Ltd. Kellton Tech Solutions Ltd. Happiest Minds Technologies Ltd. Zensar Technologies Ltd. Persistent Systems Ltd. Saksoft Ltd. Oracle Financial Services Software Ltd. More items... • 11-Jan-2023,https://groww.in/blog/best-artificial-intelligence-stocks-in-india,Best Artificial Intelligence Stocks in India 2023 - Groww
Which skill is highly paid in it?,Is C++ required for machine learning?,"IoT Solutions Architect     IoT Solution Architects have among the highest paying jobs, and they make it big in the Indian IT services industry. According to AmbitionBox, IoT Solution Architect salary in India ranges between ₹ 12.9 Lakhs to ₹ 34.0 Lakhs with an average annual salary of ₹ 30.5 Lakhs. 02-Jan-2023","https://www.naukri.com/learning/articles/top-highest-paid-jobs-it-sector/#:~:text=IoT%20Solutions%20Architect,-They%20use%20the&text=IoT%20Solution%20Architects%20have%20among,salary%20of%20%E2%82%B9%2030.5%20Lakhs.",Top 10 Highest Paid Jobs in IT Sector in 2023 | Naukri Learning
What salary is top 10%?,Is C++ required for machine learning?,"Landing in the top 10% is a fairly attainable goal for upwardly mobile Americans. A study by the Economic Policy Institute (EPI), found that the average earnings of those in the top 10% were roughly $173,000 in 2020. 30-Dec-2022","https://finance.yahoo.com/news/much-money-top-1-5-100000529.html#:~:text=Landing%20in%20the%20top%2010,were%20roughly%20%24173%2C000%20in%202020.","How much money do I need to make to be in the top 1%, 5%, and 10% in ..."
Which career has more scope in future?,Is C++ required for machine learning?,A few high potential career options in India are:    Chartered Accountant. Full Stack Software Developer. Company Secretary. Therapist (Occupational Therapy Assistant) 18-Apr-2022,"https://idreamcareer.com/blog/best-career-options-in-india/#:~:text=A%20few%20high%20potential%20career,Therapist%20(Occupational%20Therapy%20Assistant)",Best Career Options in India for a Bright Future - iDreamCareer
Which jobs are in danger of AI?,What are the advantages of machine learning?,Top 10 Most Endangered Jobs from AI White collar: Blue collar. For all jobs: human-contact / empathy / compassion. Telemarketer / telesales. Telesales are among the very first professions to be replaced. ...  Customer support. ...  Warehouse workers. ...  Clerks and operational staff. ...  Telephone operators. More items...,https://kaifulee.medium.com/top-10-most-endangered-jobs-from-ai-4675e0eff1a8,Top 10 Most Endangered Jobs from AI | by Kai-Fu Lee - Medium
What jobs AI Cannot do?,What are the advantages of machine learning?,"At its current state, it's only repetitive tasks that follow the same rules over and over which can be done by AI. Psychologists, caregivers, most engineers, human resource managers, marketing strategists, and lawyers are some roles that cannot be replaced by AI anytime in the near future”. 01-Jul-2022","https://economictimes.indiatimes.com/news/how-to/skills-or-jobs-that-wont-be-replaced-by-automation-artificial-intelligence-in-the-future/articleshow/92600222.cms#:~:text=At%20its%20current%20state%2C%20it's,anytime%20in%20the%20near%20future%E2%80%9D.","Skills or jobs that will not be replaced by Automation, Artificial Intelligence ..."
Is AI harmful in future?,What are the advantages of machine learning?,"   As Artificial Intelligence becomes more and more advanced, it will obviously take over jobs that were once performed by humans. According to a report published by the McKinsey Global Institute, around 800 million jobs could be lost worldwide because of automation by 2030. 06-Dec-2022","https://www.geeksforgeeks.org/5-dangers-of-artificial-intelligence-in-the-future/#:~:text=As%20Artificial%20Intelligence%20becomes%20more,because%20of%20automation%20by%202030.",5 Dangers of Artificial Intelligence in the Future - GeeksforGeeks
Can I learn ML without coding?,What is the simplest machine learning?,"Traditional Machine Learning requires students to know software programming, which enables them to write machine learning algorithms. But in this groundbreaking Udemy course, you'll learn Machine Learning without any coding whatsoever. As a result, it's much easier and faster to learn!","https://www.udemy.com/course/hands-on-machine-learning-without-writing-code/#:~:text=Traditional%20Machine%20Learning%20requires%20students,easier%20and%20faster%20to%20learn!",Data Science : Master Machine Learning Without Coding - Udemy
Is ML a good career?,What is the simplest machine learning?,"With a background in machine learning, you can get a high-paying job as a Machine Learning Engineer, Data Scientist, NLP Scientist, Business Intelligence Developer, or a Human-Centered Machine Learning Designer.","https://brainstation.io/career-guides/is-machine-learning-a-good-career#:~:text=With%20a%20background%20in%20machine,Human%2DCentered%20Machine%20Learning%20Designer.",Is Machine Learning a Good Career? (2023 Guide) | BrainStation®
Who are eligible for ML?,What is the simplest machine learning?,"For Machine Learning Undergraduate Level    Candidates who have completed 10, +2 in a recognized state board with science as mainstream are qualified applicants. Some colleges select candidates after a test. There are colleges which select candidates through the merit-based admission process.","https://www.careers360.com/courses/machine-learning-course#:~:text=For%20Machine%20Learning%20Undergraduate%20Level,the%20merit%2Dbased%20admission%20process.","Machine Learning Courses, Subjects, Colleges, Syllabus, Scope, Fees ..."
What is syllabus for machine learning?,Who invented AI in India?,Bachelor's Degree in Machine Learning Course Syllabus Semester 1 Semester 2 English Language and Communication Skills Programming in JAVA Data Structures and Algorithms Basic Internet Laboratory Discrete Mathematics Applied Mathematics Environmental Studies Human Resources and Rights 1 more row,https://intellipaat.com/blog/machine-learning-course-syllabus/,Machine Learning Course Syllabus - 2023 - Intellipaat
Is machine learning a lot of coding?,Who invented AI in India?,"Yes, if you're looking to pursue a career in artificial intelligence and machine learning, a little coding is necessary.","https://brainstation.io/career-guides/does-machine-learning-require-coding#:~:text=Yes%2C%20if%20you're%20looking,a%20little%20coding%20is%20necessary.",Does Machine Learning Require Coding? (2023 Guide) - BrainStation
Which institute is best for machine learning in India?,Who invented AI in India?,"Top AI institutions and programs in India Indian Institute of Science Education and Research, Bhopal. ...  Gujarat University, Ahmedabad. ...  Cochin University of Science and Technology, Kochi. ...  PSG College of Technology, Coimbatore. ...  Jain University, Bangalore. ...  Amity School of Engineering and Technology. ...  Chandigarh University. More items... • 08-Jul-2022",https://indiaai.gov.in/article/top-ai-institutions-and-programs-in-india,Top AI institutions and programs in India - INDIAai
Is AI a stressful job?,Who is father of data science?,"The database administrator is one of the most-hated AI jobs as it is extremely stressful and one mistake can provide a serious consequence in a company. Any kind of emergency situation related to the database in the existing system, this AI professional should attend, even at the cost of personal life. 10-Mar-2022","https://www.analyticsinsight.net/top-10-most-loved-and-most-hated-ai-jobs-of-2022/#:~:text=The%20database%20administrator%20is%20one,the%20cost%20of%20personal%20life.",Top 10 Most-Loved and Most-Hated AI Jobs of 2022 - Analytics Insight
What is the salary of freshers in machine learning in India?,Who is father of data science?,Average starting Salary for Machine Learning Engineer in India is around ₹3.0 Lakhs per year (₹25.0k per month).,"https://www.ambitionbox.com/profile/machine-learning-engineer-salary#:~:text=Average%20starting%20Salary%20for%20Machine,%E2%82%B925.0k%20per%20month).",Machine Learning Engineer Salary in India - AmbitionBox
Which job has highest salary in India?,Who is father of data science?,Top 11 Highest Paying Jobs in India Medical Professionals (Doctors and Surgeons) Data Scientist. Machine Learning Experts. Blockchain Developer. Full Stack Software Developer. Product Management. Management Consultant. Investment Banker. More items... • 12-Jan-2023,https://www.simplilearn.com/highest-paying-jobs-in-india-article,Top 11 Highest Paying Jobs In India to Start a Career in 2023 | Simplilearn
Which college AI course is best?,What is the salary of AI and ML in India?,Top Engineering Colleges Offering AI and Robotics Courses in India NRI Group of Institutions | Bengaluru. ...  Somaiya Vidyavihar University | Mumbai. ...  GNA University | Punjab. ...  Bonus: List of IITs offering complete courses in AI. IIT Patna. ...  IIT Hyderabad. ...  IIT Guwahati. ...  IIT Delhi. M. More items... • 27-Oct-2022,https://analyticsindiamag.com/top-engineering-colleges-offering-ai-robotics-courses-in-india/,Top Engineering Colleges Offering AI & Robotics Courses in India
What is the fees of Artificial Intelligence course?,What is the salary of AI and ML in India?,"Artificial Intelligence Course fees in Bangalore is priced at Rs. 54,000.","https://www.simplilearn.com/artificial-intelligence-training-courses-bangalore-city#:~:text=Artificial%20Intelligence%20Course%20fees%20in,54%2C000.",Best Artificial Intelligence Course in Bangalore [#1 AI Training]
Which degree is best for Artificial Intelligence?,What is the salary of AI and ML in India?,A Bachelor's or Master's in Computer Science is the traditional degree for working in artificial intelligence.,"https://www.mastersinai.org/faq/what-degree-for-artificial-intelligence/#:~:text=A%20Bachelor's%20or%20Master's%20in,for%20working%20in%20artificial%20intelligence.",The Best Degrees for Learning Artificial Intelligence - MastersInAI.org
Which country has best coder?,Who is father of AI?,"What are the top Countries in Coding and Programming? 1- China. One important thing that China considers when it comes to coding education is that it always links coding to the future, and that's how they come as the leaders and stand on top of the list. ...  2- Russia. ...  3- Poland. ...  4- Switzerland. ...  5- Hungary. ",https://robogarden.medium.com/top-5-countries-in-coding-and-programming-1c7fd5a0c321,Top 5 Countries in Coding and Programming | by RoboGarden
Which developer has highest salary?,Who is father of AI?,Here's the list of some of the highest-paid software jobs. Big data engineers. ...  Data architects. ...  Data security analyst. ...  Data scientists. ...  DevOps engineer. ...  Mobile app developer. ...  Full-stack developers. ...  Data warehouse architects. More items...,https://www.turing.com/kb/top-10-highest-paying-software-jobs,Top 10 Incredibly Highest Paying Software Jobs in 2023 - Turing
What are the 5 main coding languages?,Who is father of AI?,"   In this article, we'll explore some of the most common types of programming languages and give you some resources you can use to start learning. ...  Some common object-oriented programming (OOP) languages include: Java. Python. PHP. C++ Ruby. 30-Nov-2022",https://www.coursera.org/articles/types-programming-language,5 Types of Programming Languages - Coursera
What is Python maximum salary?,What type of AI is Siri?,"In general, Python developers can expect to earn salaries in the range of ₹4,00,000 to ₹8,00,000 per year, but they are depending upon their experience and skills. 02-Feb-2023","https://www.simplilearn.com/python-developer-salary-article#:~:text=In%20general%2C%20Python%20developers%20can,upon%20their%20experience%20and%20skills.",Python Developer Salary for Freshers and Experienced - Simplilearn
What is the salary of Python in India?,What type of AI is Siri?,"In India, the median salary stands at INR 29,400, which indicates that 50% of the population is earning below the INR 29,400 mark while the other half is earning more than INR 29,400. If you are an employee in India, you would definitely want to sit on the side that earns more than the median salary. 03-Dec-2022","https://inhuntworld.com/what-is-the-average-salary-in-india/#:~:text=In%20India%2C%20the%20median%20salary,more%20than%20the%20median%20salary.",What Is the Average Salary in India - InHunt World
Can I master Python in 3 years?,What type of AI is Siri?,"If you're looking for a general answer, here it is: If you just want to learn the Python basics, it may only take a few weeks. However, if you're pursuing a data science career from the beginning, you can expect it to take four to twelve months to learn enough advanced Python to be job-ready. 04-Aug-2022","https://www.dataquest.io/blog/how-long-does-it-take-to-learn-python/#:~:text=If%20you're%20looking%20for,Python%20to%20be%20job%2Dready.",How Long Does It Really Take to Learn Python? (2023 Version)
Is ML in demand in India?,What are the top 6 technologies of AI?,The demand for these engineers are always high. The list is endless. That's the primary reason machine learning salary in India is quite high. 22-Sept-2022,"https://www.upgrad.com/blog/machine-learning-engineer-salary-in-india-freshers-experienced/#:~:text=The%20demand%20for%20these%20engineers,in%20India%20is%20quite%20high.",Machine Learning Salary in India in 2023 [For Freshers & Experienced]
What is the salary of AI and ML in India?,What are the top 6 technologies of AI?,Ai Ml Engineer salary in India ranges between ₹ 3.7 Lakhs to ₹ 22.1 Lakhs with an average annual salary of ₹ 7.0 Lakhs.,"https://www.ambitionbox.com/profile/ai-ml-engineer-salary/it-services-and-consulting-industry#:~:text=Ai%20Ml%20Engineer%20salary%20in%20India%20ranges%20between%20%E2%82%B9%203.7,salary%20of%20%E2%82%B9%207.0%20Lakhs.","Ai Ml Engineer Salary in IT Services & Consulting Companies, India"
What is the salary of machine learning expert in India?,What are the top 6 technologies of AI?,Machine Learning Specialist salary in India ranges between ₹ 3.7 Lakhs to ₹ 26.5 Lakhs with an average annual salary of ₹ 12.3 Lakhs.,"https://www.ambitionbox.com/profile/machine-learning-specialist-salary#:~:text=Machine%20Learning%20Specialist%20salary%20in%20India%20ranges%20between%20%E2%82%B9%203.7,salary%20of%20%E2%82%B9%2012.3%20Lakhs.",Machine Learning Specialist Salary in India - AmbitionBox
Should I learn AI or ML first?,Can fresher Get ML job?,"Otherwise, it would be better for you to start out with machine learning since there is a lot of free material around for you to learn from and it is very high in demand right now. Machine learning is actually considered as a subset of artificial intelligence.","https://www.kaggle.com/general/168594#:~:text=Otherwise%2C%20it%20would%20be%20better,a%20subset%20of%20artificial%20intelligence.",What should I learn first Machine Learning or Artificial Intelligence
Which language is needed for ML?,Can fresher Get ML job?,"   Python leads the pack, with 57% of data scientists and machine learning developers using it and 33% prioritising it for development. Little wonder, given all the evolution in the deep learning Python frameworks over the past 2 years, including the release of TensorFlow and a wide selection of other libraries.","https://towardsdatascience.com/what-is-the-best-programming-language-for-machine-learning-a745c156d6b7#:~:text=Python%20leads%20the%20pack%2C%20with,wide%20selection%20of%20other%20libraries.",What is the best programming language for Machine Learning?
Can I learn AI in 3 months?,Can fresher Get ML job?,Artificial Intelligence    The real world projects from the industry experts would definitely give all the course takers to become a practical expert for the field of AI for Robotics. The course usually takes 2.5 to 3 months to complete and can be easily done along with a full-time job!,"https://towardsdatascience.com/top-5-courses-that-can-make-you-an-ai-ml-expert-within-6-months-53af64c26d73#:~:text=Artificial%20Intelligence,-Nanodegree%20Program%20Prerequisite&text=The%20real%20world%20projects%20from,with%20a%20full%2Dtime%20job!",Top 5 courses that can make you an AI/ML expert within 6 months
What are the 3 C's of machine learning?,What is the salary of ML developer in India?,"Any Intelligent system has three major components of intelligence, one is Comparison, two is Computation and three is Cognition. These three C's in the process of any intelligent action is a sequential process. 16-Feb-2020","https://www.linkedin.com/pulse/three-cs-artificial-intelligence-sudhakaran-srambikal#:~:text=Any%20Intelligent%20system%20has%20three,action%20is%20a%20sequential%20process.",The Three C's of Artificial Intelligence - LinkedIn
What are the 2 types of learning ML?,What is the salary of ML developer in India?,"There are primarily three types of machine learning: Supervised, Unsupervised, and Reinforcement Learning. Let's explore and understand the different types of machine learning one by one. 02-Feb-2023","https://www.simplilearn.com/tutorials/machine-learning-tutorial/types-of-machine-learning#:~:text=There%20are%20primarily%20three%20types,machine%20learning%20one%20by%20one.",Types of Machine Learning | Simplilearn
What is algorithm in machine learning?,What is the salary of ML developer in India?,"A machine learning algorithm is the method by which the AI system conducts its task, generally predicting output values from given input data. The two main processes of machine learning algorithms are classification and regression.","https://www.techtarget.com/whatis/definition/machine-learning-algorithm#:~:text=A%20machine%20learning%20algorithm%20is,algorithms%20are%20classification%20and%20regression.",What is machine learning algorithm? | Definition from TechTarget
What are the 4 basics of machine learning?,What is the salary of ML developer in India?,"   Machine Learning techniques are divided mainly into the following 4 categories: Supervised Learning. Supervised learning is applicable when a machine has sample data, i.e., input as well as output data with correct labels. ...  Unsupervised Learning. ...  Reinforcement Learning. ...  Semi-supervised Learning. ",https://www.javatpoint.com/basic-concepts-in-machine-learning,Basic Concepts in Machine Learning - Javatpoint
What are the main 3 types of ML models?,What is the salary of ML developer in India?,"Amazon ML supports three types of ML models: binary classification, multiclass classification, and regression. The type of model you should choose depends on the type of target that you want to predict.","https://docs.aws.amazon.com/machine-learning/latest/dg/types-of-ml-models.html#:~:text=Amazon%20ML%20supports%20three%20types,that%20you%20want%20to%20predict.",Types of ML Models - Amazon Machine Learning
What are the 4 branches of machine learning?,What is the salary of ML developer in India?,"There are four types of machine learning algorithms: supervised, semi-supervised, unsupervised and reinforcement.","https://www.sas.com/en_gb/insights/articles/analytics/machine-learning-algorithms.html#:~:text=There%20are%20four%20types%20of,%2Dsupervised%2C%20unsupervised%20and%20reinforcement.",A guide to the types of machine learning algorithms | SAS UK
What are the 7 stages of machine learning are?,Which job has highest salary?,The 7 Steps of Machine Learning Data Collection. → The quantity & quality of your data dictate how accurate our model is. ...  Data Preparation. → Wrangle data and prepare it for training. ...  Choose a Model. ...  Train the Model. ...  Evaluate the Model. ...  Parameter Tuning. ...  Make Predictions. 19-Oct-2022,https://www.kdnuggets.com/2018/05/general-approaches-machine-learning-process.html,Frameworks for Approaching the Machine Learning Process
What are main types of machine learning?,Which job has highest salary?,"The three machine learning types are supervised, unsupervised, and reinforcement learning. 14-Sept-2022","https://www.coursera.org/articles/types-of-machine-learning#:~:text=The%20three%20machine%20learning%20types,%2C%20unsupervised%2C%20and%20reinforcement%20learning.",3 Types of Machine Learning You Should Know | Coursera
What is ML and its types?,Which job has highest salary?,"   As explained, machine learning algorithms have the ability to improve themselves through training. Today, ML algorithms are trained using three prominent methods. These are three types of machine learning: supervised learning, unsupervised learning, and reinforcement learning. 13-Dec-2019","https://www.potentiaco.com/what-is-machine-learning-definition-types-applications-and-examples/#:~:text=As%20explained%2C%20machine%20learning%20algorithms,unsupervised%20learning%2C%20and%20reinforcement%20learning.","What Is Machine Learning: Definition, Types, Applications and Examples"
What is an example of machine learning?,Which IT skill has highest salary in India?,"   1. Image recognition. Image recognition is a well-known and widespread example of machine learning in the real world. It can identify an object as a digital image, based on the intensity of the pixels in black and white images or colour images. 09-Sept-2021","https://www.salesforce.com/eu/blog/2020/06/real-world-examples-of-machine-learning.html#:~:text=1.,white%20images%20or%20colour%20images.",6 Real-World Examples of Machine Learning - Salesforce Blog
What is difference between machine learning and AI?,Which IT skill has highest salary in India?,"An “intelligent” computer uses AI to think like a human and perform tasks on its own. Machine learning is how a computer system develops its intelligence. One way to train a computer to mimic human reasoning is to use a neural network, which is a series of algorithms that are modeled after the human brain.","https://azure.microsoft.com/en-in/solutions/ai/artificial-intelligence-vs-machine-learning/#:~:text=An%20%E2%80%9Cintelligent%E2%80%9D%20computer%20uses%20AI,modeled%20after%20the%20human%20brain.",Artificial intelligence (AI) vs. machine learning (ML) - Microsoft Azure
Why is it called machine learning?,Which IT skill has highest salary in India?,"The term “machine learning” was coined by Arthur Samuel, a computer scientist at IBM and a pioneer in AI and computer gaming. Samuel designed a computer program for playing checkers. The more the program played, the more it learned from experience, using algorithms to make predictions. 14-Mar-2022","https://www.expert.ai/blog/machine-learning-definition/#:~:text=The%20term%20%E2%80%9Cmachine%20learning%E2%80%9D%20was,using%20algorithms%20to%20make%20predictions.",What Is Machine Learning? A Definition. - Expert.ai
What software is best for machine learning?,Is ML a good career?,"   TensorFlow. The standard name for Machine Learning in the Data Science industry is TensorFlow. ...  Shogun. Shogun is a popular, open-source machine learning software. ...  Apache Mahout. ...  Apache Spark MLlib. ...  Oryx 2. ...  H20.ai. ...  Pytorch. ...  RapidMiner. More items...",https://data-flair.training/blogs/machine-learning-software/,Top 11 Machine Learning Software - Learn before you regret! - DataFlair
