PAA Title,Parent,Text,URL,URL Title
Which Python career is best?,Which software is better than Python?,"Web developer with Python skills can also earn in the range of Rs 8,00,000 per annum. Other related job roles include lead software engineer (up to Rs 2,000,000 per annum), data scientist (Rs 7,00,000 per annum), machine learning engineer (Rs 6,70,000 per annum), data analyst (4,17,000 per annum), and more. 21-Sept-2022","https://www.upgrad.com/blog/career-opportunities-in-python/#:~:text=Web%20developer%20with%20Python%20skills,per%20annum)%2C%20and%20more.",Career Opportunities in Python: Everything You Need To Know [2023]
Which coding language is best?,Which software is better than Python?,"   What Are the Best Programming Languages to Learn in 2023? Python. Python is a high-level, general-purpose programming language. ...  C# C# is an object-oriented programming language – a model that organizes software design around objects. ...  C++ ...  JavaScript. ...  PHP. ...  Swift. ...  Java. ...  Go. More items... • 04-Jan-2023",https://www.hostinger.com/tutorials/best-programming-languages-to-learn,10 Best Programming Languages to Learn Development Skills - Hostinger
Is Python easier than C++?,Is SQL easy or python?,"Python's syntax is a lot closer to English and so it is easier to read and write, making it the simplest type of code to learn how to write and develop with. The readability of C++ code is weak in comparison and it is known as being a language that is a lot harder to get to grips with.","https://www.ko2.co.uk/c-plus-plus-vs-python/#:~:text=Python's%20syntax%20is%20a%20lot,to%20get%20to%20grips%20with.",C++ vs Python - What You Need to Know - KO2 Recruitment
Is Python enough for data science?,Is SQL easy or python?,"Python is a high-level, general-purpose programming language known for its intuitive syntax that mimics natural language. You can use Python code for a wide variety of tasks, but three popular applications include: Data science and data analysis. Web application development. 30-Jan-2023","https://www.coursera.org/articles/python-or-r-for-data-analysis#:~:text=Python%20is%20a%20high%2Dlevel,Web%20application%20development",Python or R for Data Analysis: Which Should I Learn? - Coursera
What are the 5 types of SQL?,Is SQL is backend or frontend?,These SQL commands are mainly categorized into five categories as: DDL – Data Definition Language. DQL – Data Query Language. DML – Data Manipulation Language. DCL – Data Control Language. TCL – Transaction Control Language. 30-Nov-2022,https://www.geeksforgeeks.org/sql-ddl-dql-dml-dcl-tcl-commands/,"SQL | DDL, DQL, DML, DCL and TCL Commands - GeeksforGeeks"
What type of coding is SQL?,Is SQL is backend or frontend?,Structured Query Language (SQL) is a standardized programming language that is used to manage relational databases and perform various operations on the data in them.,"https://www.techtarget.com/searchdatamanagement/definition/SQL#:~:text=Structured%20Query%20Language%20(SQL)%20is,on%20the%20data%20in%20them.",What is Structured Query Language (SQL)? - TechTarget
Which pays more Java or Python?,Why Java is better than Python?,"Salary and Jobs    In India, the average salary for a Java developer is ₹4,55,000 per annum(Source: Glassdoor) and for a Python developer, it is ₹4,46,000 per annum(Source: Glassdoor). So if you become flawless in Java or Python, you can easily start your career as a developer. 30-Nov-2022","https://codedamn.com/news/programming/python-vs-java-difference#:~:text=Salary%20and%20Jobs,-It%20doesn't&text=In%20India%2C%20the%20average%20salary,your%20career%20as%20a%20developer.","Python vs Java: Difference in performance, salaries and more"
What code is best to learn first?,Why Java is better than Python?,Python is one of the most chosen programming languages to learn first for its wide use and simplicity. It is a great stepping stone to learning more complex programming languages and frameworks! 12-Aug-2022,"https://emeritus.org/blog/what-coding-language-should-i-learn/#:~:text=Python%20is%20one%20of%20the,complex%20programming%20languages%20and%20frameworks!",What Coding Language Should I Learn to Succeed in Life? - Emeritus
Which Indian companies use Python?,Which industry uses Python?,"Delhi GOF Consulting Pvt. Ltd., New Delhi. Initto technology, Delhi. Learning Concepts, Delhi. Open Labs , Noida. SoundSource Consultancy, Delhi. Srijan Technologies, Pvt. Ltd., Delhi. Tata Consultancy Service Ltd., Gurgaon. Gale Technologies, Noida. 28-Jan-2022",https://wiki.python.org/moin/BangPypers/PythonCompaniesInIndia,Python Companies in India
Does NASA use Python?,Which industry uses Python?,"Here's how it works: Data from NASA's Deep Space Network feeds down into the Space Telescope Science Institute's processing systems using Python. “And that's where my code comes in,” Mike Swam, the data processing team lead who worked on JWST, said on an episode of the podcast Talk Python to Me in March 2022. 14-Jul-2022","https://www.codecademy.com/resources/blog/nasa-james-webb-space-telescope-python-data/#:~:text=Here's%20how%20it%20works%3A%20Data,to%20Me%20in%20March%202022.",How NASA James Webb Space Telescope Uses Python & Coding
Which coding language is high in demand?,Which pays more Java or Python?,"Since its creation to make the firsts websites dynamic, JavaScript hasn't stopped gaining popularity over the years. With that being said, currently JavaScript is the most demanded programming language in the entire market. 11-Dec-2022","https://www.devjobsscanner.com/blog/top-8-most-demanded-languages-in-2022/#:~:text=Since%20its%20creation%20to%20make,language%20in%20the%20entire%20market.",Top 8 Most Demanded Programming Languages in 2022 - Devjobsscanner
Which language gives highest salary in India?,Which pays more Java or Python?,A Look at 10 Highest Paying Programming Languages In India Python. ...  Kotlin. ...  TypeScript. ...  Swift. ...  Logica. ...  PHP. ...  Go. ...  5 IT Jobs That Are Best For 2023 and Beyond. Download the Shine app to get the latest job-related updates. More items... • 21-Oct-2022,https://learning.shine.com/talenteconomy/career-help/a-look-at-10-highest-paying-programming-languages-in-india/,A Look at 10 Highest Paying Programming Languages In India
What is the hardest code to learn?,What code is best to learn first?,Malbolge. Malbolge was invented in 1998 by Ben Olmstead. This esolang is considered to be the most complicated programming language. 04-Jun-2022,"https://www.lokajittikayatray.com/post/5-most-difficult-programming-languages-in-the-world#:~:text=Malbolge,the%20most%20complicated%20programming%20language.",5 Most Difficult Programming Languages in the World
What is the best age to start coding?,What code is best to learn first?,6-7  Early elementary school is the optimum time for children to begin coding. Strengthening cognitive skills through coding helps to plant seeds for eventual complex knowledge. We have confidence in the fact that the optimal age for children to begin learning to code is around the age of 6-7. 14-Dec-2022,"https://www.geekedu.org/blogs/at-what-age-can-a-child-start-coding#:~:text=Early%20elementary%20school%20is%20the,the%20age%20of%206%2D7.",At What Age Can A Child Start Coding? | Ultimate Guides for Parents
Does Bill Gates know coding?,What code is best to learn first?,"Bill Gates recently took part in his ninth Reddit AMA. Ever wondered if Bill Gates could still write the code that made him a billionaire? As the co-founder of Microsoft, Bill Gates is considered to be one of the pioneers of today's home computing, but he admits that his programming skills are now a little ""rusty"". 22-Mar-2021","https://www.ndtv.com/offbeat/bill-gates-says-his-coding-skills-are-now-rusty-2396476#:~:text=Bill%20Gates%20recently%20took%20part,now%20a%20little%20%22rusty%22.",Bill Gates Says His Coding Skills Are Now ""Rusty"" - NDTV.com
Why is C++ not used in AI?,Is SQL useful for AI?,"This is because C++ is a low level programming language, so it is not used very often in AI. 25-Nov-2020","https://www.upgrad.com/blog/artificial-intelligence-projects-in-cplusplus/#:~:text=This%20is%20because%20C%2B%2B%20is,used%20very%20often%20in%20AI.",Top Artificial Intelligence Projects in C++ You Should Check Out - upGrad
Is AI or Python better?,Is SQL useful for AI?,"While machine learning and artificial intelligence are based on complex algorithms and workflows, Python, with its easy-to-write code, allows developers to focus on solving ML problems rather than technical nuances of the language. That's why many programmers consider Python to be more intuitive than other languages. 07-Mar-2022","https://dac.digital/which-is-better-for-ai-python-or-r/#:~:text=While%20machine%20learning%20and%20artificial,more%20intuitive%20than%20other%20languages.",Which is better for AI - Python or R? - DAC.digital
Is C++ necessary for AI?,Is SQL useful for AI?,"C++ isn't always the first choice for AI-focused applications, but it's so widely used throughout the industry that it's worth mentioning. This language runs and executes very efficiently, but the trade-off is that it's more complex to write.","https://bootcamp.berkeley.edu/blog/ai-programming-languages/#:~:text=C%2B%2B%20isn't%20always%20the,it's%20more%20complex%20to%20write.",Top 6 AI Programming Languages to Learn in 2023 | Berkeley Boot Camps
Which language is best for AI?,Is AI or Java better?,   8 Best Programming Languages for AI Development in 2023 Python. Lisp. Java. C++ R. Julia. Prolog. Haskell. ,https://www.trio.dev/blog/best-languages-for-ai,8 Best Programming Languages for AI Development in 2023 - Trio.dev
Which is most demanded Java or Python?,Is AI or Java better?,"Java is popular among programmers interested in web development, big data, cloud development, and Android app development. Python is favored by those working in back-end development, app development, data science, and machine learning. 28-Jul-2022","https://www.coursera.org/articles/python-vs-java#:~:text=Java%20is%20popular%20among%20programmers,data%20science%2C%20and%20machine%20learning.",Python vs. Java: Which Should I Learn? - Coursera
Who is known as the father of AI?,Is AI or Java better?,"One of the greatest innovators in the field was John McCarthy, widely recognized as the father of Artificial Intelligence due to his astounding contribution in the field of Computer Science and AI. 29-Oct-2020","https://www.artificial-solutions.com/blog/homage-to-john-mccarthy-the-father-of-artificial-intelligence#:~:text=One%20of%20the%20greatest%20innovators,of%20Computer%20Science%20and%20AI.","Homage to John McCarthy, the Father of Artificial Intelligence (AI)"
What jobs will AI replace?,Can AI write its own code?,"With rapid advances in deep learning and robotics, it appears clear that soon AI will replace military personnel as pilots and engineers, something that could potentially provide vast advantages to modern militaries worldwide.","https://www.beyond.agency/blog/will-ai-take-my-job#:~:text=With%20rapid%20advances%20in%20deep,advantages%20to%20modern%20militaries%20worldwide.",Will AI take my job? - Beyond Agency
What software is used for AI?,Can AI write its own code?,"Google Cloud AI Platform    For companies that decided to build their platform on Google Cloud (GCP), it is a popular platform for scientists and developers. The AI software tools of Google Cloud allow developers to work on machine learning projects in a time-saving and cost-effective way.","https://viso.ai/deep-learning/ai-software/#:~:text=Google%20Cloud%20AI%20Platform,-With%20Google%20Cloud&text=For%20companies%20that%20decided%20to,saving%20and%20cost%2Deffective%20way.",The 13 Most Popular AI Software Products in 2023 - Viso Suite
What jobs can AI not replace?,Can AI write its own code?,8. 12 jobs that AI can't replace Human resource managers. A company's Human Resources department will always need a human to manage interpersonal conflict. ...  Writers. Writers have to ideate and produce original written content. ...  Lawyers. ...  Chief executives. ...  Scientists. ...  Clergyman. ...  Psychiatrists. ...  Event planners. More items... • 22-Mar-2021,https://www.saviom.com/blog/12-jobs-that-robots-ai-will-replace-in-the-future-and-12-that-wont/,"12 jobs that robots (AI) will replace in the future, and 12 that won't - Saviom"
Which language is best for ML?,Is AI or Python better?,"Java is highly scalable. This makes it great for creating complex, large-scale ML algorithms. Many big data frameworks like Hadoop, Hive, and Spark (used for ML) are also Java-based. The Java Virtual Machine allows users to create machine learning tools fast and roll them out at speed. 07-Dec-2022","https://careerfoundry.com/en/blog/data-analytics/best-machine-learning-languages/#:~:text=Java%20is%20highly%20scalable.,roll%20them%20out%20at%20speed.",What's the Best Language for Machine Learning? [2023 Guide]
Is AI or Java better?,Is AI or Python better?,Both the languages Java and Python are equally capable of bringing upon a revolution. But recently Python has gained much prominence due to its edge in AI and ML. But some programmers still prefer Java for programming and building AI applications. 08-Oct-2021,"https://www.springboard.com/blog/data-science/which-is-better-for-ai-java-or-python/#:~:text=Both%20the%20languages%20Java%20and,programming%20and%20building%20AI%20applications.",Which is Better for AI: Java or Python? - Springboard
Is AI better than coding?,Is AI or Python better?,"   Allowing machines to perceive and train them to predict is defined with AI while coding believes in building the computer system. While there is no will, there is no way. While there is no coding, there is no field of Computer Science implemented. Keep Learning!","https://medium.com/@harinisureshla/ai-vs-coding-1720065253c9#:~:text=Allowing%20machines%20to%20perceive%20and,Keep%20Learning!",AI vs Coding. While the concepts of Artificial… | by Harini Suresh
Can I learn AI in 3 months?,Which AI language is easiest?,Artificial Intelligence    The real world projects from the industry experts would definitely give all the course takers to become a practical expert for the field of AI for Robotics. The course usually takes 2.5 to 3 months to complete and can be easily done along with a full-time job!,"https://towardsdatascience.com/top-5-courses-that-can-make-you-an-ai-ml-expert-within-6-months-53af64c26d73#:~:text=Artificial%20Intelligence,-Nanodegree%20Program%20Prerequisite&text=The%20real%20world%20projects%20from,with%20a%20full%2Dtime%20job!",Top 5 courses that can make you an AI/ML expert within 6 months
Can I study AI without coding?,Which AI language is easiest?,"Machine Learning without programming is occupying that space and making AI accessible for everyone. This is because you can gain Artificial Intelligence without a single line of code, whether your business is large or small. And this is closing the gap between technology experts and businesses. 16-Nov-2022","https://levity.ai/blog/no-code-machine-learning-guide#:~:text=Machine%20Learning%20without%20programming%20is,between%20technology%20experts%20and%20businesses.",No-Code Machine Learning: The Ultimate Guide - Levity AI
Which country is best for AI learning?,Which AI language is easiest?,"However, some countries are known for their significant contributions to the field of AI, including the United States, China, Canada, and several European countries, such as the United Kingdom, France, and Germany. 09-Dec-2022","https://finance.yahoo.com/news/13-most-advanced-countries-artificial-233616079.html#:~:text=However%2C%20some%20countries%20are%20known,Kingdom%2C%20France%2C%20and%20Germany.",13 Most Advanced Countries in Artificial Intelligence - Yahoo Finance
Can I learn Python in 2 days?,How long to learn Python?,,,
Can I learn Python in 7 days?,How long to learn Python?,,,
Why Java is better than Python?,How long to learn Python?,,,
Is C++ used in machine learning?,Is Google a machine learning?,"C++ can make your machine learning models run faster and more efficiently. This handy guide will help you learn the fundamentals of machine learning (ML), showing you how to use C++ libraries to get the most out of your data.","https://www.packtpub.com/product/hands-on-machine-learning-with-c/9781789955330#:~:text=C%2B%2B%20can%20make%20your%20machine,most%20out%20of%20your%20data.",Hands-On Machine Learning with C++ - Packt
Which tool is best for machine learning?,Is Google a machine learning?,"Top 10 tools for ML model training TensorFlow. Source: tensorflow.org. ...  PyTorch. Source: pytorch,org. ...  PyTorch Lightning. Source: pytorchlightning.ai. ...  Scikit-learn. Source: scikit-learn.org. ...  Catalyst. Source: catalyst-team.com. ...  XGBoost. Source: xgboost.ai. ...  LightGBM. Source: LightGBS docs. ...  CatBoost. Source: catboost.ai. More items...",https://neptune.ai/blog/top-10-best-machine-learning-tools-for-model-training,Top 10 Best Machine Learning Tools for Model Training - neptune.ai
What are the 4 basics of machine learning?,Is Google a machine learning?,"   Machine Learning techniques are divided mainly into the following 4 categories: Supervised Learning. Supervised learning is applicable when a machine has sample data, i.e., input as well as output data with correct labels. ...  Unsupervised Learning. ...  Reinforcement Learning. ...  Semi-supervised Learning. ",https://www.javatpoint.com/basic-concepts-in-machine-learning,Basic Concepts in Machine Learning - Javatpoint
What is the difference between AI and machine learning?,What are the 3 types of machine learning?,Artificial Intelligence (AI) is an umbrella term for computer software that mimics human cognition in order to perform complex tasks and learn from them. Machine learning (ML) is a subfield of AI that uses algorithms trained on data to produce adaptable models that can perform a variety of complex tasks. 06-Jan-2023,"https://www.coursera.org/articles/machine-learning-vs-ai#:~:text=Artificial%20Intelligence%20(AI)%20is%20an,a%20variety%20of%20complex%20tasks.","Machine Learning vs. AI: Differences, Uses, and Benefits | Coursera"
What are the 7 steps of machine learning?,What are the 3 types of machine learning?,The 7 Steps of Machine Learning Data Collection. → The quantity & quality of your data dictate how accurate our model is. ...  Data Preparation. → Wrangle data and prepare it for training. ...  Choose a Model. ...  Train the Model. ...  Evaluate the Model. ...  Parameter Tuning. ...  Make Predictions. 19-Oct-2022,https://www.kdnuggets.com/2018/05/general-approaches-machine-learning-process.html,Frameworks for Approaching the Machine Learning Process
What is machine learning used for?,What are the 3 types of machine learning?,"Machine learning is used in internet search engines, email filters to sort out spam, websites to make personalised recommendations, banking software to detect unusual transactions, and lots of apps on our phones such as voice recognition.","https://royalsociety.org/topics-policy/projects/machine-learning/videos-and-background-information/#:~:text=Machine%20learning%20is%20used%20in,phones%20such%20as%20voice%20recognition.",What is machine learning? | Royal Society
What are the 3 types of machine learning?,Who invented machine learning?,"The three machine learning types are supervised, unsupervised, and reinforcement learning. 14-Sept-2022","https://www.coursera.org/articles/types-of-machine-learning#:~:text=The%20three%20machine%20learning%20types,%2C%20unsupervised%2C%20and%20reinforcement%20learning.",3 Types of Machine Learning You Should Know | Coursera
Why is it called machine learning?,Who invented machine learning?,,,
What is machine learning examples?,Who invented machine learning?,,,
Who invented AI in India?,Who is the mother of AI?,Raj Reddy Scientific career Fields Artificial Intelligence Robotics Human-Computer Interaction Institutions IIIT Hyderabad Carnegie Mellon University Stanford University Doctoral advisor John McCarthy 7 more rows,https://en.wikipedia.org/wiki/Raj_Reddy,Raj Reddy - Wikipedia
Is AI a girl or boy?,Who is the mother of AI?,"Yes, many bots and AI agents are cast as female, especially voice assistants. Siri and Alexa have names that identify them as women. That's because when testing the systems, developers discovered that users were more comfortable with female assistants, perhaps because of a stereotype of women as helpmates. 16-Jan-2020","https://techonomy.com/is-ai-male/#:~:text=Yes%2C%20many%20bots%20and%20AI,stereotype%20of%20women%20as%20helpmates.",Is AI Male? - Techonomy
Is AI Japanese or Chinese?,Who is the mother of AI?,→ Japanese: 愛 あい (ai),https://en.wiktionary.org/wiki/%E6%84%9B#:~:text=%E2%86%92%20Japanese%3A%20%E6%84%9B%20%E3%81%82%E3%81%84%20(ai),愛 - Wiktionary
What is another name for machine learning?,Why is it called machine learning?,"In its application across business problems, machine learning is also referred to as predictive analytics.","https://en.wikipedia.org/wiki/Machine_learning#:~:text=In%20its%20application%20across%20business,referred%20to%20as%20predictive%20analytics.",Machine learning - Wikipedia
Is machine learning full of coding?,Why is it called machine learning?,"Yes, if you're looking to pursue a career in artificial intelligence and machine learning, a little coding is necessary.","https://brainstation.io/career-guides/does-machine-learning-require-coding#:~:text=Yes%2C%20if%20you're%20looking,a%20little%20coding%20is%20necessary.",Does Machine Learning Require Coding? (2023 Guide) - BrainStation
Why is python used for machine learning?,Why is it called machine learning?,"Python is a programming language that distinguishes itself from other programming languages by its flexibility, simplicity, and reliable tools required to create modern software. Python is consistent and is anchored on simplicity, which makes it most appropriate for machine learning. 19-Jan-2023","https://corporatefinanceinstitute.com/resources/knowledge/other/python-in-machine-learning/#:~:text=Python%20is%20a%20programming%20language%20that%20distinguishes%20itself%20from%20other,most%20appropriate%20for%20machine%20learning.","Python (Machine Learning) - Overview, Advantages"
What are benefits of machine learning?,What is the purpose of machine learning?,10 benefits of machine learning Natural language processing. ...  Recognising images. ...  Data mining. ...  Autonomous vehicles. ...  Better advertising and marketing. ...  Better products. ...  Speech recognition. ...  Detecting fraud. More items... • 05-Dec-2022,https://uk.indeed.com/career-advice/career-development/benefits-of-machine-learning,10 key benefits of machine learning (with uses and FAQs) - Indeed
What technology is used in machine learning?,What is the purpose of machine learning?,"Machine learning is a branch of artificial intelligence (AI) and computer science which focuses on the use of data and algorithms to imitate the way that humans learn, gradually improving its accuracy.","https://www.ibm.com/topics/machine-learning#:~:text=Machine%20learning%20is%20a%20branch,learn%2C%20gradually%20improving%20its%20accuracy.",What is Machine Learning? | IBM
What is ML and its types?,What is the purpose of machine learning?,"   As explained, machine learning algorithms have the ability to improve themselves through training. Today, ML algorithms are trained using three prominent methods. These are three types of machine learning: supervised learning, unsupervised learning, and reinforcement learning. 13-Dec-2019","https://www.potentiaco.com/what-is-machine-learning-definition-types-applications-and-examples/#:~:text=As%20explained%2C%20machine%20learning%20algorithms,unsupervised%20learning%2C%20and%20reinforcement%20learning.","What Is Machine Learning: Definition, Types, Applications and Examples"
What is AI engineer salary in India?,Can average student do artificial intelligence?,"The entry-level annual average AI engineer salary in India is around 8 lakhs, which is significantly higher than the average salary of any other engineering graduate. At high-level positions, the AI engineer salary can be as high as 50 lakhs. AI engineers earn an average salary of well over $100,000 annually. 27-Jan-2023","https://www.simplilearn.com/ai-engineer-salary-article#:~:text=The%20entry%2Dlevel%20annual%20average,of%20well%20over%20%24100%2C000%20annually.","AI Engineer Salary in 2023: US, India, Canada and More | Simplilearn"
Who earns more AI or data science?,Can average student do artificial intelligence?,"According to PayScale, the average data scientist salary is 812, 855 lakhs per annum while the artificial intelligence engineer salary is 1,500, 641 lakhs per annum.","https://www.analyticsinsight.net/which-career-should-you-choose-data-science-vs-artificial-intelligence/#:~:text=According%20to%20PayScale%2C%20the%20average,1%2C500%2C%20641%20lakhs%20per%20annum.",Which Career Should You Choose? Data Science vs Artificial Intelligence
Is Python enough for AI?,Can average student do artificial intelligence?,Its syntax is consistent so people learning the language are able to read others' code as well as write their own quite easily. The algorithms and calculations that implementation requires are complex enough with the language used being difficult too. Python's simplicity really lends itself to AI and machine learning.,"https://www.sphereinc.com/blogs/is-python-fast-enough-for-machine-learning/#:~:text=Its%20syntax%20is%20consistent%20so,to%20AI%20and%20machine%20learning.",Is Python Fast Enough for Machine Learning? - Sphere Partners
